{
  "boundaries": [
    "All published identifier-shaped dwords use capture-local pseudonyms.",
    "Neighborhoods contain five preceding and five following s2c wrapped events in one admitted lane.",
    "Separate TCP directions and separate connection blocks are never concatenated into chronology.",
    "Snapshot shapes describe observed packet order only; they do not establish creation, removal, causality, or policy.",
    "The RaptureElementContainer+0x4D8 field is a nullable pointer gate, not packet marker data.",
    "No packet in this study is attributed to selector 0x0D creation without direct linking evidence."
  ],
  "corpus": {
    "admitted_chat_lanes": 30,
    "admitted_lanes": 84,
    "admitted_main_lanes": 54,
    "admitted_unparsed_frame_body_bytes": 0,
    "all_connection_retransmitted_overlap_bytes": 33424,
    "c2s_frames": 8970,
    "c2s_subevents": 21201,
    "c2s_wrapped_subevents": 21109,
    "captures": 54,
    "compressed_frame_inflate_failures": 0,
    "corpus_sha256": "1293490808399dd5e1015d921a388f0fe4931dfa3ef678f30d790f5296025e6a",
    "decoded_target_events": 592,
    "discarded_c2s_trailing_stream_bytes": 0,
    "discarded_s2c_trailing_stream_bytes": 228,
    "discarded_trailing_stream_bytes": 228,
    "excluded_connection_retransmitted_overlap_bytes": 102,
    "frame_shaped_connections": 88,
    "retransmitted_c2s_overlap_bytes": 288,
    "retransmitted_overlap_bytes": 33322,
    "retransmitted_s2c_overlap_bytes": 33034,
    "s2c_frames": 10790,
    "s2c_subevents": 44663,
    "s2c_wrapped_subevents": 44556,
    "subevent_truncations": 0,
    "target_c2s_events": 0,
    "target_s2c_events": 592,
    "wrapped_short_inner_headers": 0
  },
  "correlations": {
    "bounded_neighborhood": {
      "actor_lifecycle": {
        "occurrences_immediately_after": 36,
        "occurrences_immediately_before": 20,
        "occurrences_within_5_after": 112,
        "occurrences_within_5_before": 92
      },
      "group_layout_018b": {
        "occurrences_immediately_after": 22,
        "occurrences_immediately_before": 10,
        "occurrences_within_5_after": 66,
        "occurrences_within_5_before": 43
      },
      "group_update": {
        "occurrences_immediately_after": 32,
        "occurrences_immediately_before": 25,
        "occurrences_within_5_after": 85,
        "occurrences_within_5_before": 75
      },
      "setup_0193": {
        "occurrences_immediately_after": 1,
        "occurrences_immediately_before": 0,
        "occurrences_within_5_after": 2,
        "occurrences_within_5_before": 0
      },
      "zone_transition": {
        "occurrences_immediately_after": 0,
        "occurrences_immediately_before": 0,
        "occurrences_within_5_after": 0,
        "occurrences_within_5_before": 0
      }
    },
    "first_marker_order": {
      "actor_lifecycle": {
        "lanes_with_any_prior": 5,
        "lanes_with_first_marker": 38,
        "lanes_with_immediate_prior": 1
      },
      "group_layout_018b": {
        "lanes_with_any_prior": 3,
        "lanes_with_first_marker": 38,
        "lanes_with_immediate_prior": 1
      },
      "group_update": {
        "lanes_with_any_prior": 5,
        "lanes_with_first_marker": 38,
        "lanes_with_immediate_prior": 2
      },
      "setup_0193": {
        "lanes_with_any_prior": 1,
        "lanes_with_first_marker": 38,
        "lanes_with_immediate_prior": 0
      },
      "zone_transition": {
        "lanes_with_any_prior": 1,
        "lanes_with_first_marker": 38,
        "lanes_with_immediate_prior": 0
      }
    },
    "tested_opcode_sets": {
      "actor_lifecycle": [
        "0x0007",
        "0x00ca",
        "0x00cb",
        "0x00cc"
      ],
      "group_layout_018b": [
        "0x018b"
      ],
      "group_update": [
        "0x0143",
        "0x017a",
        "0x017c",
        "0x017d",
        "0x017e",
        "0x017f",
        "0x0183",
        "0x0187",
        "0x018b"
      ],
      "setup_0193": [
        "0x0193"
      ],
      "zone_transition": [
        "0x0005",
        "0x0006",
        "0x0007",
        "0x0008",
        "0x000f",
        "0x0010"
      ]
    }
  },
  "distributions": {
    "chronology_shapes": {
      "changed-same-count-nonempty": 371,
      "first-observed-nonempty": 38,
      "increased-count-nonempty": 1,
      "repeated-nonempty": 182
    },
    "events_by_capture": {
      "accept_leve.pcapng": 6,
      "accept_local_leve.pcapng": 5,
      "accept_quest.pcapng": 4,
      "add_str.pcapng": 2,
      "battle_mode_passive_mode.pcapng": 1,
      "buy_square_maple_shield.pcapng": 6,
      "change_to_botanist.pcapng": 5,
      "chat_say.pcapng": 1,
      "chat_shout.pcapng": 1,
      "coerthas_map.pcapng": 2,
      "combat_autoattack.pcapng": 8,
      "combat_skills.pcapng": 7,
      "from_gridania_to_blackshroud.pcapng": 22,
      "gather_wood.pcapng": 18,
      "gridania_map.pcapng": 2,
      "gridania_to_coerthas.pcapng": 94,
      "harvest.pcapng": 6,
      "idle_in_party.pcapng": 2,
      "idling.pcapng": 6,
      "invite_join_party.pcapng": 10,
      "local_leve_complete.pcapng": 43,
      "mount_unmount_chocobo.pcapng": 2,
      "move_around_gridania.pcapng": 22,
      "move_out_of_room.pcapng": 6,
      "moving_around_gridania.pcapng": 85,
      "party_battle_leve.pcapng": 134,
      "quest_update.pcapng": 8,
      "repair_items.pcapng": 6,
      "return_to_inn.pcapng": 3,
      "sell_item.pcapng": 6,
      "small_talk_louisoix.pcapng": 3,
      "switch_to_weaver.pcapng": 4,
      "teleport_to_camp_nine_ivies.pcapng": 8,
      "teleport_to_camp_tranquil.pcapng": 7,
      "teleport_to_gridania.pcapng": 7,
      "war_quest_update1.pcapng": 5,
      "war_quest_update2.pcapng": 23,
      "war_quest_update3.pcapng": 12
    },
    "events_by_lane": {
      "main": 592
    },
    "marker_counts": {
      "1": 415,
      "2": 177
    },
    "records": 769,
    "unique_capture_local_snapshots": 410
  },
  "exclusions": {
    "count_exceeds_reserved_capacity": 0,
    "lobby_54994_connections": 2,
    "nonfinite_record_float": 0,
    "nonzero_reserved_tail": 0,
    "other_non_game_connections": 0,
    "tls_signature_connections": 2,
    "unexpected_application_shape": 0,
    "unexpected_subevent_size": 0
  },
  "per_capture": {
    "accept_leve.pcapng": {
      "admitted_chat_lanes": 1,
      "admitted_lanes": 2,
      "admitted_main_lanes": 1,
      "all_connection_retransmitted_overlap_bytes": 396,
      "decoded_events": 6,
      "discarded_trailing_stream_bytes": 6,
      "excluded_connection_retransmitted_overlap_bytes": 0,
      "exclusions": {},
      "frame_shaped_connections": 2,
      "retransmitted_overlap_bytes": 396,
      "target_c2s_events": 0,
      "target_s2c_events": 6
    },
    "accept_local_leve.pcapng": {
      "admitted_chat_lanes": 0,
      "admitted_lanes": 1,
      "admitted_main_lanes": 1,
      "all_connection_retransmitted_overlap_bytes": 336,
      "decoded_events": 5,
      "discarded_trailing_stream_bytes": 6,
      "excluded_connection_retransmitted_overlap_bytes": 0,
      "exclusions": {},
      "frame_shaped_connections": 1,
      "retransmitted_overlap_bytes": 336,
      "target_c2s_events": 0,
      "target_s2c_events": 5
    },
    "accept_quest.pcapng": {
      "admitted_chat_lanes": 1,
      "admitted_lanes": 2,
      "admitted_main_lanes": 1,
      "all_connection_retransmitted_overlap_bytes": 204,
      "decoded_events": 4,
      "discarded_trailing_stream_bytes": 6,
      "excluded_connection_retransmitted_overlap_bytes": 0,
      "exclusions": {},
      "frame_shaped_connections": 2,
      "retransmitted_overlap_bytes": 204,
      "target_c2s_events": 0,
      "target_s2c_events": 4
    },
    "action_and_traits.pcapng": {
      "admitted_chat_lanes": 0,
      "admitted_lanes": 1,
      "admitted_main_lanes": 1,
      "all_connection_retransmitted_overlap_bytes": 330,
      "decoded_events": 0,
      "discarded_trailing_stream_bytes": 6,
      "excluded_connection_retransmitted_overlap_bytes": 0,
      "exclusions": {},
      "frame_shaped_connections": 1,
      "retransmitted_overlap_bytes": 330,
      "target_c2s_events": 0,
      "target_s2c_events": 0
    },
    "add_str.pcapng": {
      "admitted_chat_lanes": 0,
      "admitted_lanes": 1,
      "admitted_main_lanes": 1,
      "all_connection_retransmitted_overlap_bytes": 180,
      "decoded_events": 2,
      "discarded_trailing_stream_bytes": 6,
      "excluded_connection_retransmitted_overlap_bytes": 0,
      "exclusions": {},
      "frame_shaped_connections": 1,
      "retransmitted_overlap_bytes": 180,
      "target_c2s_events": 0,
      "target_s2c_events": 2
    },
    "attributes.pcapng": {
      "admitted_chat_lanes": 0,
      "admitted_lanes": 1,
      "admitted_main_lanes": 1,
      "all_connection_retransmitted_overlap_bytes": 216,
      "decoded_events": 0,
      "discarded_trailing_stream_bytes": 0,
      "excluded_connection_retransmitted_overlap_bytes": 0,
      "exclusions": {},
      "frame_shaped_connections": 1,
      "retransmitted_overlap_bytes": 216,
      "target_c2s_events": 0,
      "target_s2c_events": 0
    },
    "battle_mode_passive_mode.pcapng": {
      "admitted_chat_lanes": 1,
      "admitted_lanes": 2,
      "admitted_main_lanes": 1,
      "all_connection_retransmitted_overlap_bytes": 84,
      "decoded_events": 1,
      "discarded_trailing_stream_bytes": 0,
      "excluded_connection_retransmitted_overlap_bytes": 0,
      "exclusions": {},
      "frame_shaped_connections": 2,
      "retransmitted_overlap_bytes": 84,
      "target_c2s_events": 0,
      "target_s2c_events": 1
    },
    "buy_square_maple_shield.pcapng": {
      "admitted_chat_lanes": 1,
      "admitted_lanes": 2,
      "admitted_main_lanes": 1,
      "all_connection_retransmitted_overlap_bytes": 378,
      "decoded_events": 6,
      "discarded_trailing_stream_bytes": 6,
      "excluded_connection_retransmitted_overlap_bytes": 0,
      "exclusions": {},